{
  "run_id": "pilot_a05_version_parser__qwen3.5_9b__v1__20261007T045448Z",
  "timestamp": "2026-10-07T04:56:05.611013+00:00",
  "model_provider": "soclaas",
  "requested_model_id": "qwen3.5:9b",
  "returned_model_id": null,
  "model_snapshot": null,
  "temperature": 0,
  "seed": null,
  "context_limit": 65536,
  "max_steps": 40,
  "timeout_minutes": 20,
  "reasoning_setting": null,
  "max_output_tokens": null,
  "task_id": "pilot_a05_version_parser",
  "task_hash": "8d95dd79662f2a49d66adfbb4c37fdc03e7f6723be2443a5c4af0b6e0484f496",
  "split": "pilot",
  "skill_id": "A",
  "skill_version": "v1",
  "skill_hash": "32f7eacfcc8719414a41f3dbaf5c25c5ae02e0932b630d060e94f7898fb2c409",
  "tool_schema_version": 1,
  "verifier_hash": "6b0dd3c7b93e3411398e2ca5c2196f1be5104827a0e08faaa83e4f3a437b9090",
  "harness_git_commit": "2339adf3f52eb73cae3fe7881317797bd9fe42c1",
  "container_image": null
}
