{
  "run_id": "pilot_b03_duplicate_audit__qwen3.5_9b__v1__20261007T050028Z",
  "timestamp": "2026-10-07T05:01:10.426895+00:00",
  "model_provider": "soclaas",
  "requested_model_id": "qwen3.5:9b",
  "returned_model_id": null,
  "model_snapshot": null,
  "temperature": 0,
  "seed": null,
  "context_limit": 65536,
  "max_steps": 40,
  "timeout_minutes": 20,
  "reasoning_setting": null,
  "max_output_tokens": null,
  "task_id": "pilot_b03_duplicate_audit",
  "task_hash": "6f7c9f6d4459068594884de201e181886ca6afd2c445749e2fb5d0746f19ba99",
  "split": "pilot",
  "skill_id": "B",
  "skill_version": "v1",
  "skill_hash": "bc8eb2214bb764ec2ea94e38c43a4af47be67bc2376c1ac9f826b9347857ed94",
  "tool_schema_version": 1,
  "verifier_hash": "daa69353be6ed769e94b919fb91616be801fd97e90ba8f05aa3d1df77c0927b8",
  "harness_git_commit": "2339adf3f52eb73cae3fe7881317797bd9fe42c1",
  "container_image": null
}
