{
  "run_id": "pilot_a03_record_deduplication__qwen3.5_9b__v1__20261007T045220Z",
  "timestamp": "2026-10-07T04:52:36.568514+00:00",
  "model_provider": "soclaas",
  "requested_model_id": "qwen3.5:9b",
  "returned_model_id": null,
  "model_snapshot": null,
  "temperature": 0,
  "seed": null,
  "context_limit": 65536,
  "max_steps": 40,
  "timeout_minutes": 20,
  "reasoning_setting": null,
  "max_output_tokens": null,
  "task_id": "pilot_a03_record_deduplication",
  "task_hash": "da638ff00be3942d34581259267565647c2fc99a952eab3b38204a9b49b397e1",
  "split": "pilot",
  "skill_id": "A",
  "skill_version": "v1",
  "skill_hash": "32f7eacfcc8719414a41f3dbaf5c25c5ae02e0932b630d060e94f7898fb2c409",
  "tool_schema_version": 1,
  "verifier_hash": "fbefdda14074bdaae671f40cace80eefc36eefc80cbcb243a8d41b337d613486",
  "harness_git_commit": "2339adf3f52eb73cae3fe7881317797bd9fe42c1",
  "container_image": null
}
