{
  "run_id": "pilot_b02_json_normalization__qwen3-coder-next__20261006T112442Z",
  "timestamp": "2026-10-06T11:25:25.073137+00:00",
  "model_provider": "soclaas",
  "requested_model_id": "qwen3-coder-next",
  "returned_model_id": null,
  "model_snapshot": null,
  "temperature": 0,
  "seed": null,
  "context_limit": 65536,
  "max_steps": 40,
  "timeout_minutes": 20,
  "reasoning_setting": null,
  "max_output_tokens": null,
  "task_id": "pilot_b02_json_normalization",
  "task_hash": "6dec5d726e02ab5236703c60283a3c4075741bad951d664e88f083e90bd7e08a",
  "split": "pilot",
  "skill_id": "B",
  "skill_version": "v0",
  "skill_hash": "eb25c58e2e4754d86eb2669b76e5cb6a2f1e697b566c58a453c278fab1e421de",
  "tool_schema_version": 1,
  "verifier_hash": "e147946a92e05acc315ce0e70106a5c399de993964949b40202b4d4cb91b7cd9",
  "harness_git_commit": "d324f6dc887e0a30ff7c571686e2f38e9e793a25",
  "container_image": null
}
