{
  "run_id": "pilot_a02_config_parser__qwen3.5_9b__20261006T111456Z",
  "timestamp": "2026-10-06T11:16:36.436762+00:00",
  "model_provider": "soclaas",
  "requested_model_id": "qwen3.5:9b",
  "returned_model_id": null,
  "model_snapshot": null,
  "temperature": 0,
  "seed": null,
  "context_limit": 65536,
  "max_steps": 40,
  "timeout_minutes": 20,
  "reasoning_setting": null,
  "max_output_tokens": null,
  "task_id": "pilot_a02_config_parser",
  "task_hash": "1b5296be5c25322ffb9ed609c5b64c0b7e90ae1eb2767ff6d78fa9fa076f34ba",
  "split": "pilot",
  "skill_id": "A",
  "skill_version": "v0",
  "skill_hash": "dc21abe4db14593b77d3d85065362a655dd0d84cde2c318d5a757a3241ca3d4c",
  "tool_schema_version": 1,
  "verifier_hash": "55d9fcc40625d2dd42cff98b29bfcf6259e9c07d9ec96fb3c4e484f1244b2e04",
  "harness_git_commit": "7bc4dd5e07bdb532f7c3116b02d34d68bb0ce5ab",
  "container_image": null
}
