{
  "run_id": "pilot_a03_record_deduplication__qwen3.5_9b__20261007T022548Z",
  "timestamp": "2026-10-07T02:28:42.583978+00:00",
  "model_provider": "soclaas",
  "requested_model_id": "qwen3.5:9b",
  "returned_model_id": null,
  "model_snapshot": null,
  "temperature": 0,
  "seed": null,
  "context_limit": 65536,
  "max_steps": 40,
  "timeout_minutes": 20,
  "reasoning_setting": null,
  "max_output_tokens": null,
  "task_id": "pilot_a03_record_deduplication",
  "task_hash": "da638ff00be3942d34581259267565647c2fc99a952eab3b38204a9b49b397e1",
  "split": "pilot",
  "skill_id": "A",
  "skill_version": "v0",
  "skill_hash": "dc21abe4db14593b77d3d85065362a655dd0d84cde2c318d5a757a3241ca3d4c",
  "tool_schema_version": 1,
  "verifier_hash": "fbefdda14074bdaae671f40cace80eefc36eefc80cbcb243a8d41b337d613486",
  "harness_git_commit": "64d7d376ab11cd93f0dcc3eb9f424a8f3be0a5c6",
  "container_image": null
}
