{
  "run_id": "pilot_b01_csv_cleaning__qwen3.8_27b__20261006T112207Z",
  "timestamp": "2026-10-06T11:22:59.828318+00:00",
  "model_provider": "soclaas",
  "requested_model_id": "qwen3.8:27b",
  "returned_model_id": null,
  "model_snapshot": null,
  "temperature": 0,
  "seed": null,
  "context_limit": 65536,
  "max_steps": 40,
  "timeout_minutes": 20,
  "reasoning_setting": null,
  "max_output_tokens": null,
  "task_id": "pilot_b01_csv_cleaning",
  "task_hash": "60406e415df564576cd4e40a69d401e55b2fa2acc5d60d2f63b15c1790df8d44",
  "split": "pilot",
  "skill_id": "B",
  "skill_version": "v0",
  "skill_hash": "eb25c58e2e4754d86eb2669b76e5cb6a2f1e697b566c58a453c278fab1e421de",
  "tool_schema_version": 1,
  "verifier_hash": "cdb1fd5ccfa947278784770f8cc5b87907d36383139a852b66df337e80ab5ceb",
  "harness_git_commit": "01b9c747f2d5b80e6246db4eabc98f39681a0320",
  "container_image": null
}
