{
  "run_id": "pilot_b05_date_validation__qwen3.5_9b__20261007T023106Z",
  "timestamp": "2026-10-07T02:31:28.092117+00:00",
  "model_provider": "soclaas",
  "requested_model_id": "qwen3.5:9b",
  "returned_model_id": null,
  "model_snapshot": null,
  "temperature": 0,
  "seed": null,
  "context_limit": 65536,
  "max_steps": 40,
  "timeout_minutes": 20,
  "reasoning_setting": null,
  "max_output_tokens": null,
  "task_id": "pilot_b05_date_validation",
  "task_hash": "64072ba1218cefa9917115e4d04b77ba9a3cdeef78516e8789a26cc14f728cd4",
  "split": "pilot",
  "skill_id": "B",
  "skill_version": "v0",
  "skill_hash": "eb25c58e2e4754d86eb2669b76e5cb6a2f1e697b566c58a453c278fab1e421de",
  "tool_schema_version": 1,
  "verifier_hash": "62105166a04f1eecb0defa9166a2a36e680deb8ae76349e441933caffcc7515e",
  "harness_git_commit": "64d7d376ab11cd93f0dcc3eb9f424a8f3be0a5c6",
  "container_image": null
}
