{
  "run_id": "pilot_b05_date_validation__qwen3.5_9b__v1__20261007T050257Z",
  "timestamp": "2026-10-07T05:03:39.263189+00:00",
  "model_provider": "soclaas",
  "requested_model_id": "qwen3.5:9b",
  "returned_model_id": null,
  "model_snapshot": null,
  "temperature": 0,
  "seed": null,
  "context_limit": 65536,
  "max_steps": 40,
  "timeout_minutes": 20,
  "reasoning_setting": null,
  "max_output_tokens": null,
  "task_id": "pilot_b05_date_validation",
  "task_hash": "64072ba1218cefa9917115e4d04b77ba9a3cdeef78516e8789a26cc14f728cd4",
  "split": "pilot",
  "skill_id": "B",
  "skill_version": "v1",
  "skill_hash": "bc8eb2214bb764ec2ea94e38c43a4af47be67bc2376c1ac9f826b9347857ed94",
  "tool_schema_version": 1,
  "verifier_hash": "62105166a04f1eecb0defa9166a2a36e680deb8ae76349e441933caffcc7515e",
  "harness_git_commit": "2339adf3f52eb73cae3fe7881317797bd9fe42c1",
  "container_image": null
}
