{
  "run_id": "pilot_a05_version_parser__qwen3.5_9b__20261007T022857Z",
  "timestamp": "2026-10-07T02:30:20.968948+00:00",
  "model_provider": "soclaas",
  "requested_model_id": "qwen3.5:9b",
  "returned_model_id": null,
  "model_snapshot": null,
  "temperature": 0,
  "seed": null,
  "context_limit": 65536,
  "max_steps": 40,
  "timeout_minutes": 20,
  "reasoning_setting": null,
  "max_output_tokens": null,
  "task_id": "pilot_a05_version_parser",
  "task_hash": "8d95dd79662f2a49d66adfbb4c37fdc03e7f6723be2443a5c4af0b6e0484f496",
  "split": "pilot",
  "skill_id": "A",
  "skill_version": "v0",
  "skill_hash": "dc21abe4db14593b77d3d85065362a655dd0d84cde2c318d5a757a3241ca3d4c",
  "tool_schema_version": 1,
  "verifier_hash": "6b0dd3c7b93e3411398e2ca5c2196f1be5104827a0e08faaa83e4f3a437b9090",
  "harness_git_commit": "64d7d376ab11cd93f0dcc3eb9f424a8f3be0a5c6",
  "container_image": null
}
