{
  "run_id": "pilot_b03_duplicate_audit__qwen3.5_9b__20261007T023034Z",
  "timestamp": "2026-10-07T02:30:55.500655+00:00",
  "model_provider": "soclaas",
  "requested_model_id": "qwen3.5:9b",
  "returned_model_id": null,
  "model_snapshot": null,
  "temperature": 0,
  "seed": null,
  "context_limit": 65536,
  "max_steps": 40,
  "timeout_minutes": 20,
  "reasoning_setting": null,
  "max_output_tokens": null,
  "task_id": "pilot_b03_duplicate_audit",
  "task_hash": "6f7c9f6d4459068594884de201e181886ca6afd2c445749e2fb5d0746f19ba99",
  "split": "pilot",
  "skill_id": "B",
  "skill_version": "v0",
  "skill_hash": "eb25c58e2e4754d86eb2669b76e5cb6a2f1e697b566c58a453c278fab1e421de",
  "tool_schema_version": 1,
  "verifier_hash": "daa69353be6ed769e94b919fb91616be801fd97e90ba8f05aa3d1df77c0927b8",
  "harness_git_commit": "64d7d376ab11cd93f0dcc3eb9f424a8f3be0a5c6",
  "container_image": null
}
